{"$schema":"https://json-schema.org/draft/2020-12/schema","title":"Pasol Pattern Scan Request 1.0.0","type":"object","additionalProperties":false,"required":["schema_version","input","pack","limits"],"properties":{"schema_version":{"const":"1.0.0"},"input":{"type":"object","required":["sha256","size_bytes"],"properties":{"sha256":{"type":"string","pattern":"^[0-9a-f]{64}$"},"size_bytes":{"type":"integer","minimum":0},"file_type":{"type":"string"}}},"pack":{"type":"object"},"limits":{"type":"object"}}}
